{
  "created_at": "2026-10-08T11:00:00.000Z",
  "metadata": {
    "cwd": "/work/dashboard",
    "harness_version": "2.1.292",
    "session_id": "3b7e2f90-1c44-4a6d-8e15-9d0a7c5b2e61"
  },
  "name": "The chart in this screenshot looks wrong. Compare it with charts/expected.png",
  "schema": "session/v0",
  "source": {
    "fidelity": "reconstructed",
    "harness": "claude-code",
    "kind": "import",
    "label": "session-import@0.1.0"
  },
  "spans": [
    {
      "ended_at": "2026-10-08T11:00:08.000Z",
      "id": "root",
      "name": "The chart in this screenshot looks wrong. Compare it with charts/expected.png",
      "parent_id": null,
      "started_at": "2026-10-08T11:00:00.000Z",
      "status": "ok",
      "type": "agent"
    },
    {
      "ended_at": "2026-10-08T11:00:03.000Z",
      "id": "s1",
      "input": {
        "messages": [
          {
            "content": [
              {
                "text": "The chart in this screenshot looks wrong. Compare it with charts/expected.png",
                "type": "text"
              },
              {
                "mime": "image/png",
                "type": "image",
                "url": "data:image/png;base64,iVBORw0KGgoAAAANSUhEUgAAAAYAAAAGCAIAAABvrngfAAAAfUlEQVR42gFyAI3/AEQggjz95vHCazD5DsfdAeSIdQA0og8LDQTDbtgOceD9d7B2cOsAlAvVM1+XParYYZuR/8kR9XzOANRYu78s4DdTyb36D/AWnclXVgB0BmZ2z7C064kCxEJp2hz2umYA0/i21LEAqeoOdVpcLoIQJCoIlx43hnD9UNQAAAAASUVORK5CYII="
              }
            ],
            "role": "user"
          }
        ]
      },
      "model": {
        "id": "claude-opus-5-5",
        "provider": "anthropic"
      },
      "name": "turn",
      "output": {
        "messages": [
          {
            "content": [
              {
                "arguments": {
                  "file_path": "charts/expected.png"
                },
                "id": "toolu_img_1",
                "name": "Read",
                "type": "tool_call"
              }
            ],
            "role": "assistant"
          }
        ]
      },
      "parent_id": "root",
      "started_at": "2026-10-08T11:00:00.000Z",
      "status": "ok",
      "type": "llm_call",
      "usage": {
        "input_tokens": 700,
        "output_tokens": 15
      }
    },
    {
      "ended_at": "2026-10-08T11:00:04.000Z",
      "id": "s2",
      "input": {
        "arguments": {
          "file_path": "charts/expected.png"
        },
        "name": "Read",
        "tool_call_id": "toolu_img_1"
      },
      "name": "Read",
      "output": {
        "result": {
          "file": {
            "base64": "iVBORw0KGgoAAAANSUhEUgAAAAYAAAAGCAIAAABvrngfAAAAfUlEQVR42gFyAI3/ABwuK7hWnYBsElHcyb7jiRIOugDuo8LYVFp4dgxaplhFuF3k1LoAtbnkUszsf/qO/7Xo7LPp+XGmAFWJ9Z6b0J9q+rsmrgRhNh4ZiwB0NkWIfWse2BAdubhYfwwqOiIADBQKv4JBUF4AxRZ+TRICsDmSvBo0XYC9rhgAAAAASUVORK5CYII=",
            "originalSize": 150,
            "type": "image/png"
          },
          "type": "image"
        }
      },
      "parent_id": "s1",
      "started_at": "2026-10-08T11:00:03.000Z",
      "status": "ok",
      "type": "tool_call"
    },
    {
      "ended_at": "2026-10-08T11:00:08.000Z",
      "id": "s3",
      "input": {
        "messages": [
          {
            "content": [
              {
                "content": [
                  {
                    "mime": "image/png",
                    "type": "image",
                    "url": "data:image/png;base64,iVBORw0KGgoAAAANSUhEUgAAAAYAAAAGCAIAAABvrngfAAAAfUlEQVR42gFyAI3/ABwuK7hWnYBsElHcyb7jiRIOugDuo8LYVFp4dgxaplhFuF3k1LoAtbnkUszsf/qO/7Xo7LPp+XGmAFWJ9Z6b0J9q+rsmrgRhNh4ZiwB0NkWIfWse2BAdubhYfwwqOiIADBQKv4JBUF4AxRZ+TRICsDmSvBo0XYC9rhgAAAAASUVORK5CYII="
                  }
                ],
                "tool_call_id": "toolu_img_1",
                "type": "tool_result"
              }
            ],
            "role": "tool"
          }
        ]
      },
      "model": {
        "id": "claude-opus-5-5",
        "provider": "anthropic"
      },
      "name": "turn",
      "output": {
        "messages": [
          {
            "content": [
              {
                "text": "The screenshot's y-axis starts at 40; the expected chart starts at 0.",
                "type": "text"
              }
            ],
            "role": "assistant"
          }
        ]
      },
      "parent_id": "root",
      "started_at": "2026-10-08T11:00:04.000Z",
      "status": "ok",
      "type": "llm_call",
      "usage": {
        "input_tokens": 700,
        "output_tokens": 15
      }
    }
  ]
}
